{
  "checks": {
    "cleanup_complete": true,
    "drifted_upgrade_refused": true,
    "enhanced_insert_guard_refused_drift": true,
    "failed_upgrade_history_preserved": true,
    "failed_upgrade_revision_preserved": true,
    "failed_upgrade_trigger_preserved": true,
    "pre_drift_dump_list_verified": true,
    "pre_drift_restore_verified": true,
    "restored_upgrade_to_head": true,
    "successful_upgrade_history_preserved": true
  },
  "executed_at": "2026-10-03T03:18:39+00:00",
  "history": {
    "invalid_history_sha256": "7384d0a6b70c466e099461bb28b24a979f90cd0c78ea8ae97e5cdf1d77e950a4",
    "invalid_versions": 3,
    "pre_drift_dump_sha256": "288aa703b69a878602fdc1e8d497697670ca4077cf1fb50202a1e39eeb8ce016",
    "valid_history_sha256": "ec931f9cf25e1b9f8c1b39cc83e6c38e2bc3384b669516505a46d4aaabb30886",
    "valid_versions": 2
  },
  "limitations": [
    "single_disposable_postgresql_node",
    "synthetic_data_and_credentials_only",
    "one_postgresql_version",
    "no_live_provider_or_accounting_posting",
    "no_cross_host_ha_dr_or_production_claim"
  ],
  "profile": "disposable-postgresql-writeback-identity-migration",
  "report_digest": "d4bf1b9a7560f06fa4d9e9cd8e1b0c491a15920592bf61f8cbb7100b3fe83f3c",
  "runtime": {
    "docker_server": "29.8.1",
    "image": "postgres:17.10-alpine@sha256:742f40ea20b9ff2ff31db5458d127452988a2164df9e17441e191f3b72252193",
    "postgresql": "17.10",
    "source_revision": "0088_pg_currency_snapshot",
    "target_revision": "0094_pg_finance_policy"
  },
  "schema_version": "postgres-writeback-identity-migration-drill-v1",
  "subject": {
    "migration_commit": "c7e357335c71a15889375be01bd3e6bf8d70041c",
    "migration_source_sha256": "92e42b27e1ef043ce9be9a44130efadc61daa6953b85aa516e5f7e7e03a6a4b0",
    "runner_source_sha256": "dba3943b5bdc43be7ce06b50d70f0e1f0414c1102e4f3c80a41a749fe6f50719"
  }
}
